Anomaly_Type,Description_Norm,Counterparty_Core,Rule_ID,Txn_Count,Total_Amount,Avg_Amount,First_YearMonth,Last_YearMonth,Months_Span,Unique_Months,Recurrence_Pattern,Bank_Rail_Breakdown,Suggested_Category
OTHER_INCOME,CHEQUE DEPOSIT,CHEQUE DEPOSIT,R14_OTHER_INCOME,2,267653.37,133826.68,2023-11,2025-02,16,2,ONE_OFF,CHEQUE:$267653,
DISCRETIONARY,MISC DEBIT SB1012426283801,MISC DEBIT SB1012426283801,R15_GENERIC_OUTFLOW,1,-100000.0,-100000.0,2024-09,2024-09,1,1,ONE_OFF,OTHER:$100000,
OTHER_INCOME,PAYNOW-FAST PAYNOW OTHR TWINCAR LEASING PTE,PAYNOW-FAST PAYNOW OTHR TWINCAR LEASING PTE,R14_OTHER_INCOME,1,76000.0,76000.0,2025-11,2025-11,1,1,ONE_OFF,FAST:$76000,
DISCRETIONARY,PAYNOW-FAST MOTOR IMAGE ENTERPR MBK2511208260871899,PAYNOW-FAST MOTOR IMAGE ENTERPR MBK2511208260871899,R15_GENERIC_OUTFLOW,1,-68550.15,-68550.15,2025-11,2025-11,1,1,ONE_OFF,FAST:$68550,POSSIBLE_TRANSFER
DISCRETIONARY,PAYNOW-FAST PIB2408063198789257 KERING SOUTH EAST AS OTHR TRANSFER - UEN,PAYNOW-FAST PIB2408063198789257 KERING SOUTH EAST AS OTHR TRANSFER - UEN,R15_GENERIC_OUTFLOW,1,-28323.91,-28323.91,2024-08,2024-08,1,1,ONE_OFF,FAST:$28323,POSSIBLE_TRANSFER
DISCRETIONARY,PAYNOW-FAST PIB2404052022050233 SINGJOY PTE. LTD. OTHR INV-22308,PAYNOW-FAST PIB2404052022050233 SINGJOY PTE. LTD. OTHR INV-22308,R15_GENERIC_OUTFLOW,1,-23204.0,-23204.0,2024-04,2024-04,1,1,ONE_OFF,FAST:$23204,POSSIBLE_TRANSFER
DISCRETIONARY,MISC DEBIT 8018623927-00000,MISC DEBIT 8018623927-00000,R15_GENERIC_OUTFLOW,1,-20845.5,-20845.5,2024-11,2024-11,1,1,ONE_OFF,OTHER:$20845,
DISCRETIONARY,FUNDS TRANSFER MBK-3493939244,FUNDS TRANSFER MBK-3493939244,R15_GENERIC_OUTFLOW,16,-18795.0,-1174.69,2021-01,2025-05,53,14,ONE_OFF,OTHER:$18795,POSSIBLE_TRANSFER
DISCRETIONARY,MISC DEBIT (SRS) PIB2111215947733448 SRS CONT 180544711,MISC DEBIT (SRS) PIB2111215947733448 SRS CONT 180544711,R15_GENERIC_OUTFLOW,1,-15300.0,-15300.0,2021-11,2021-11,1,1,ONE_OFF,OTHER:$15300,
DISCRETIONARY,MISC DEBIT (SRS) PIB2111215947777062 SRS CONT 180544738,MISC DEBIT (SRS) PIB2111215947777062 SRS CONT 180544738,R15_GENERIC_OUTFLOW,1,-15300.0,-15300.0,2021-11,2021-11,1,1,ONE_OFF,OTHER:$15300,
DISCRETIONARY,MISC DEBIT (SRS) PIB2210067689850163 SRS CONT 180544711,MISC DEBIT (SRS) PIB2210067689850163 SRS CONT 180544711,R15_GENERIC_OUTFLOW,1,-15300.0,-15300.0,2022-10,2022-10,1,1,ONE_OFF,OTHER:$15300,
DISCRETIONARY,MISC DEBIT (SRS) PIB2210067690358805 SRS CONT 180544738,MISC DEBIT (SRS) PIB2210067690358805 SRS CONT 180544738,R15_GENERIC_OUTFLOW,1,-15300.0,-15300.0,2022-10,2022-10,1,1,ONE_OFF,OTHER:$15300,
DISCRETIONARY,MISC DEBIT (SRS) PIB2311260779403242 SRS CONT 180544711,MISC DEBIT (SRS) PIB2311260779403242 SRS CONT 180544711,R15_GENERIC_OUTFLOW,1,-15300.0,-15300.0,2023-11,2023-11,1,1,ONE_OFF,OTHER:$15300,
DISCRETIONARY,MISC DEBIT (SRS) PIB2312030855345656 SRS CONT 180544738,MISC DEBIT (SRS) PIB2312030855345656 SRS CONT 180544738,R15_GENERIC_OUTFLOW,1,-15300.0,-15300.0,2023-12,2023-12,1,1,ONE_OFF,OTHER:$15300,
DISCRETIONARY,MISC DEBIT (SRS) PIB2402031430938038 SRS CONT 180544711,MISC DEBIT (SRS) PIB2402031430938038 SRS CONT 180544711,R15_GENERIC_OUTFLOW,1,-15300.0,-15300.0,2024-02,2024-02,1,1,ONE_OFF,OTHER:$15300,
DISCRETIONARY,MISC DEBIT (SRS) PIB2407082913305123 SRS CONT 180544738,MISC DEBIT (SRS) PIB2407082913305123 SRS CONT 180544738,R15_GENERIC_OUTFLOW,1,-15300.0,-15300.0,2024-07,2024-07,1,1,ONE_OFF,OTHER:$15300,
DISCRETIONARY,MISC DEBIT (SRS) PIB2511148203104496 SRS CONT 180544738,MISC DEBIT (SRS) PIB2511148203104496 SRS CONT 180544738,R15_GENERIC_OUTFLOW,1,-15300.0,-15300.0,2025-11,2025-11,1,1,ONE_OFF,OTHER:$15300,
DISCRETIONARY,MISC DEBIT (SRS) PIB2511268331801019 SRS CONT 180544711,MISC DEBIT (SRS) PIB2511268331801019 SRS CONT 180544711,R15_GENERIC_OUTFLOW,1,-15300.0,-15300.0,2025-11,2025-11,1,1,ONE_OFF,OTHER:$15300,
DISCRETIONARY,PAYNOW-FAST PIB2212048050781800 CENTRAL PROVIDENT FU OTHR QARR3509001840826488,PAYNOW-FAST PIB2212048050781800 CENTRAL PROVIDENT FU OTHR QARR3509001840826488,R15_GENERIC_OUTFLOW,1,-8000.0,-8000.0,2022-12,2022-12,1,1,ONE_OFF,FAST:$8000,POSSIBLE_TRANSFER
DISCRETIONARY,PAYNOW-FAST PIB2212118098859190 CENTRAL PROVIDENT FU OTHR QARR4509001966008590,PAYNOW-FAST PIB2212118098859190 CENTRAL PROVIDENT FU OTHR QARR4509001966008590,R15_GENERIC_OUTFLOW,1,-8000.0,-8000.0,2022-12,2022-12,1,1,ONE_OFF,FAST:$8000,POSSIBLE_TRANSFER
DISCRETIONARY,PAYNOW-FAST PIB2312040868146309 CENTRAL PROVIDENT FU OTHR QARR3509011183824244,PAYNOW-FAST PIB2312040868146309 CENTRAL PROVIDENT FU OTHR QARR3509011183824244,R15_GENERIC_OUTFLOW,1,-8000.0,-8000.0,2023-12,2023-12,1,1,ONE_OFF,FAST:$8000,POSSIBLE_TRANSFER
DISCRETIONARY,PAYNOW-FAST PIB2312201011223482 CENTRAL PROVIDENT FU OTHR QARR3909012322596572,PAYNOW-FAST PIB2312201011223482 CENTRAL PROVIDENT FU OTHR QARR3909012322596572,R15_GENERIC_OUTFLOW,1,-8000.0,-8000.0,2023-12,2023-12,1,1,ONE_OFF,FAST:$8000,POSSIBLE_TRANSFER
DISCRETIONARY,PAYNOW-FAST PIB2312291091597011 CENTRAL PROVIDENT FU OTHR QARS3909013194724255,PAYNOW-FAST PIB2312291091597011 CENTRAL PROVIDENT FU OTHR QARS3909013194724255,R15_GENERIC_OUTFLOW,1,-8000.0,-8000.0,2023-12,2023-12,1,1,ONE_OFF,FAST:$8000,POSSIBLE_TRANSFER
DISCRETIONARY,PAYNOW-FAST PIB2312291091654062 CENTRAL PROVIDENT FU OTHR QARS4409013195510078,PAYNOW-FAST PIB2312291091654062 CENTRAL PROVIDENT FU OTHR QARS4409013195510078,R15_GENERIC_OUTFLOW,1,-8000.0,-8000.0,2023-12,2023-12,1,1,ONE_OFF,FAST:$8000,POSSIBLE_TRANSFER
DISCRETIONARY,PAYNOW-FAST PIB2412244603058736 CENTRAL PROVIDENT FU OTHR QARR3809039789500726,PAYNOW-FAST PIB2412244603058736 CENTRAL PROVIDENT FU OTHR QARR3809039789500726,R15_GENERIC_OUTFLOW,1,-8000.0,-8000.0,2024-12,2024-12,1,1,ONE_OFF,FAST:$8000,POSSIBLE_TRANSFER
DISCRETIONARY,PAYNOW-FAST PIB2412244603225188 CENTRAL PROVIDENT FU OTHR QARR3409039791995974,PAYNOW-FAST PIB2412244603225188 CENTRAL PROVIDENT FU OTHR QARR3409039791995974,R15_GENERIC_OUTFLOW,1,-8000.0,-8000.0,2024-12,2024-12,1,1,ONE_OFF,FAST:$8000,POSSIBLE_TRANSFER
DISCRETIONARY,PAYNOW-FAST PIB2511178232780379 CENTRAL PROVIDENT FU OTHR QARR3909070562313689,PAYNOW-FAST PIB2511178232780379 CENTRAL PROVIDENT FU OTHR QARR3909070562313689,R15_GENERIC_OUTFLOW,1,-8000.0,-8000.0,2025-11,2025-11,1,1,ONE_OFF,FAST:$8000,POSSIBLE_TRANSFER
DISCRETIONARY,PAYNOW-FAST RECHERCHE INTERIOR MBK2312020842312466,PAYNOW-FAST RECHERCHE INTERIOR MBK2312020842312466,R15_GENERIC_OUTFLOW,1,-7877.4,-7877.4,2023-12,2023-12,1,1,ONE_OFF,FAST:$7877,POSSIBLE_TRANSFER
DISCRETIONARY,PAYNOW-FAST PIB2509247605659559 ODYSSEY THE GLOBAL P OTHR 0000680861QRINODSR0005,PAYNOW-FAST PIB2509247605659559 ODYSSEY THE GLOBAL P OTHR 0000680861QRINODSR0005,R15_GENERIC_OUTFLOW,1,-7801.06,-7801.06,2025-09,2025-09,1,1,ONE_OFF,FAST:$7801,POSSIBLE_TRANSFER
DISCRETIONARY,BILL PAYMENT ENETS-CENTRAL PROVI 2021112119522885524,BILL PAYMENT ENETS-CENTRAL PROVI 2021112119522885524,R15_GENERIC_OUTFLOW,1,-7000.0,-7000.0,2021-11,2021-11,1,1,ONE_OFF,CARD:$7000,
DISCRETIONARY,BILL PAYMENT ENETS-CENTRAL PROVI 2021112120050243967,BILL PAYMENT ENETS-CENTRAL PROVI 2021112120050243967,R15_GENERIC_OUTFLOW,1,-7000.0,-7000.0,2021-11,2021-11,1,1,ONE_OFF,CARD:$7000,
OTHER_INCOME,MISC CREDIT ACCOUNT CLOSURE FOR CORP A/C;,MISC CREDIT ACCOUNT CLOSURE FOR CORP A/C;,R14_OTHER_INCOME,1,6436.0,6436.0,2022-08,2022-08,1,1,ONE_OFF,OTHER:$6436,
DISCRETIONARY,PAYNOW-FAST PIB2310170439594076 WOOD & WOOD FLOORING OTHR WW/QT/ET-23-113,PAYNOW-FAST PIB2310170439594076 WOOD & WOOD FLOORING OTHR WW/QT/ET-23-113,R15_GENERIC_OUTFLOW,1,-6092.0,-6092.0,2023-10,2023-10,1,1,ONE_OFF,FAST:$6092,POSSIBLE_TRANSFER
DISCRETIONARY,PAYNOW-FAST PIB2405032284273978 SINGJOY PTE. LTD. OTHR INV-22377,PAYNOW-FAST PIB2405032284273978 SINGJOY PTE. LTD. OTHR INV-22377,R15_GENERIC_OUTFLOW,1,-5232.0,-5232.0,2024-05,2024-05,1,1,ONE_OFF,FAST:$5232,POSSIBLE_TRANSFER
DISCRETIONARY,FUNDS TRF - FAST PIB2402071482521815 052450 IVPT 2180227177LEAC,FUNDS TRF - FAST PIB2402071482521815 052450 IVPT 2180227177LEAC,R15_GENERIC_OUTFLOW,1,-5006.37,-5006.37,2024-02,2024-02,1,1,ONE_OFF,FAST:$5006,POSSIBLE_TRANSFER
DISCRETIONARY,CASH WITHDRAWAL-ATM 79608204,CASH WITHDRAWAL-ATM 79608204,R15_GENERIC_OUTFLOW,36,-4640.0,-128.89,2020-12,2024-04,41,24,SPORADIC,ATM:$4640,
DISCRETIONARY,PAYNOW-FAST RECHERCHE INTERIOR MBK2405042294278800,PAYNOW-FAST RECHERCHE INTERIOR MBK2405042294278800,R15_GENERIC_OUTFLOW,1,-4402.2,-4402.2,2024-05,2024-05,1,1,ONE_OFF,FAST:$4402,POSSIBLE_TRANSFER
OTHER_INCOME,PAYNOW-FAST PAYNOW OTHR CHAI CHANG HONG EXERCISE FEE SN2308030126,PAYNOW-FAST PAYNOW OTHR CHAI CHANG HONG EXERCISE FEE SN2308030126,R14_OTHER_INCOME,1,4000.0,4000.0,2023-08,2023-08,1,1,ONE_OFF,FAST:$4000,POSSIBLE_TRANSFER
DISCRETIONARY,PAYNOW-FAST SWEE HUAT HENG ENGI MBK2312050874920461,PAYNOW-FAST SWEE HUAT HENG ENGI MBK2312050874920461,R15_GENERIC_OUTFLOW,1,-3564.0,-3564.0,2023-12,2023-12,1,1,ONE_OFF,FAST:$3564,POSSIBLE_TRANSFER
DISCRETIONARY,PAYNOW-FAST PIB2404172133427310 THREECUBES PRIVATE L OTHR INV-20094,PAYNOW-FAST PIB2404172133427310 THREECUBES PRIVATE L OTHR INV-20094,R15_GENERIC_OUTFLOW,1,-3306.1,-3306.1,2024-04,2024-04,1,1,ONE_OFF,FAST:$3306,POSSIBLE_TRANSFER
OTHER_INCOME,INWARD CR - GIRO SUPP SUPPLIERPYMT MSF-CH DEVELOPMENT MSF-BBBB2024122804,INWARD CR - GIRO SUPP SUPPLIERPYMT MSF-CH DEVELOPMENT MSF-BBBB2024122804,R14_OTHER_INCOME,1,3000.0,3000.0,2024-04,2024-04,1,1,ONE_OFF,GIRO:$3000,
DISCRETIONARY,PAYNOW-FAST SKYGRILLES PTE. LTD MBK2312080905039570,PAYNOW-FAST SKYGRILLES PTE. LTD MBK2312080905039570,R15_GENERIC_OUTFLOW,1,-2816.0,-2816.0,2023-12,2023-12,1,1,ONE_OFF,FAST:$2816,POSSIBLE_TRANSFER
DISCRETIONARY,PAYNOW-FAST PIB2311280801652044 THREECUBES PRIVATE L OTHR QUOTE-20026,PAYNOW-FAST PIB2311280801652044 THREECUBES PRIVATE L OTHR QUOTE-20026,R15_GENERIC_OUTFLOW,1,-2750.0,-2750.0,2023-11,2023-11,1,1,ONE_OFF,FAST:$2750,POSSIBLE_TRANSFER
DISCRETIONARY,FUNDS TRANSFER MBK-3491284038,FUNDS TRANSFER MBK-3491284038,R15_GENERIC_OUTFLOW,2,-2500.0,-1250.0,2021-01,2023-01,25,2,ONE_OFF,OTHER:$2500,POSSIBLE_TRANSFER
DISCRETIONARY,PAYNOW-FAST PIB2311110659233113 SINGJOY PTE. LTD. OTHR SGQR,PAYNOW-FAST PIB2311110659233113 SINGJOY PTE. LTD. OTHR SGQR,R15_GENERIC_OUTFLOW,1,-2500.0,-2500.0,2023-11,2023-11,1,1,ONE_OFF,FAST:$2500,POSSIBLE_TRANSFER
DISCRETIONARY,PAYNOW-FAST PIB2312261058420178 KOOL CONNECTED WINDO OTHR 78248,PAYNOW-FAST PIB2312261058420178 KOOL CONNECTED WINDO OTHR 78248,R15_GENERIC_OUTFLOW,1,-2447.0,-2447.0,2023-12,2023-12,1,1,ONE_OFF,FAST:$2447,POSSIBLE_TRANSFER
DISCRETIONARY,PAYNOW-FAST MEGACOOL (SINGAPORE MBK2312140956071516,PAYNOW-FAST MEGACOOL (SINGAPORE MBK2312140956071516,R15_GENERIC_OUTFLOW,1,-2332.8,-2332.8,2023-12,2023-12,1,1,ONE_OFF,FAST:$2332,POSSIBLE_TRANSFER
DISCRETIONARY,FUNDS TRF - FAST PIB2409043481104801 0010468600 OTHR 2409042960960,FUNDS TRF - FAST PIB2409043481104801 0010468600 OTHR 2409042960960,R15_GENERIC_OUTFLOW,1,-2280.0,-2280.0,2024-09,2024-09,1,1,ONE_OFF,FAST:$2280,POSSIBLE_TRANSFER
OTHER_INCOME,FUNDS TRANSFER,FUNDS TRANSFER,R14_OTHER_INCOME,1,2095.0,2095.0,2024-05,2024-05,1,1,ONE_OFF,OTHER:$2095,
OTHER_INCOME,INWARD CR - GIRO OTHR OTHER BUILD BUILT PTE. LTD R23-444AL-VO7,INWARD CR - GIRO OTHR OTHER BUILD BUILT PTE. LTD R23-444AL-VO7,R14_OTHER_INCOME,1,1780.0,1780.0,2024-05,2024-05,1,1,ONE_OFF,GIRO:$1780,
DISCRETIONARY,FUNDS TRF - FAST PIB2411224268147710 695678292001 OTHR WENLONG-NOV24,FUNDS TRF - FAST PIB2411224268147710 695678292001 OTHR WENLONG-NOV24,R15_GENERIC_OUTFLOW,1,-1580.0,-1580.0,2024-11,2024-11,1,1,ONE_OFF,FAST:$1580,POSSIBLE_TRANSFER
DISCRETIONARY,PAYNOW-FAST PIB2409203630687694 GLOBAL TOTS MOUNTBAT OTHR SIOW WENLONG INFANT MA,PAYNOW-FAST PIB2409203630687694 GLOBAL TOTS MOUNTBAT OTHR SIOW WENLONG INFANT MA,R15_GENERIC_OUTFLOW,1,-1580.0,-1580.0,2024-09,2024-09,1,1,ONE_OFF,FAST:$1580,POSSIBLE_TRANSFER
DISCRETIONARY,PAYNOW-FAST PIB2410213945730742 GLOBAL TOTS MOUNTBAT OTHR INFANTMALDIVES- SIOW W,PAYNOW-FAST PIB2410213945730742 GLOBAL TOTS MOUNTBAT OTHR INFANTMALDIVES- SIOW W,R15_GENERIC_OUTFLOW,1,-1580.0,-1580.0,2024-10,2024-10,1,1,ONE_OFF,FAST:$1580,POSSIBLE_TRANSFER
DISCRETIONARY,PAYNOW-FAST PIB2412164523498878 GLOBAL TOTS MOUNTBAT OTHR TRANSFER - UEN,PAYNOW-FAST PIB2412164523498878 GLOBAL TOTS MOUNTBAT OTHR TRANSFER - UEN,R15_GENERIC_OUTFLOW,1,-1580.0,-1580.0,2024-12,2024-12,1,1,ONE_OFF,FAST:$1580,POSSIBLE_TRANSFER
DISCRETIONARY,PAYNOW-FAST MEGACOOL (SINGAPORE MBK2402271646789928,PAYNOW-FAST MEGACOOL (SINGAPORE MBK2402271646789928,R15_GENERIC_OUTFLOW,1,-1569.6,-1569.6,2024-02,2024-02,1,1,ONE_OFF,FAST:$1569,POSSIBLE_TRANSFER
DISCRETIONARY,PAYNOW-FAST PIB2312190999672860 WOOD & WOOD FLOORING OTHR WW/QT/ET-23-113,PAYNOW-FAST PIB2312190999672860 WOOD & WOOD FLOORING OTHR WW/QT/ET-23-113,R15_GENERIC_OUTFLOW,1,-1522.0,-1522.0,2023-12,2023-12,1,1,ONE_OFF,FAST:$1522,POSSIBLE_TRANSFER
OTHER_INCOME,INWARD CR - GIRO SUPP SUPPLIERPYMT MSF-CH DEVELOPMENT MSF-BBBB2024320013,INWARD CR - GIRO SUPP SUPPLIERPYMT MSF-CH DEVELOPMENT MSF-BBBB2024320013,R14_OTHER_INCOME,1,1500.0,1500.0,2024-10,2024-10,1,1,ONE_OFF,GIRO:$1500,
OTHER_INCOME,INWARD CR - GIRO SUPP SUPPLIERPYMT MSF-CH DEVELOPMENT MSF-BBBB2025103213,INWARD CR - GIRO SUPP SUPPLIERPYMT MSF-CH DEVELOPMENT MSF-BBBB2025103213,R14_OTHER_INCOME,1,1500.0,1500.0,2025-04,2025-04,1,1,ONE_OFF,GIRO:$1500,
OTHER_INCOME,CASH DEPOSIT-CDM,CASH DEPOSIT-CDM,R14_OTHER_INCOME,1,1200.0,1200.0,2023-05,2023-05,1,1,ONE_OFF,OTHER:$1200,
DISCRETIONARY,PAYNOW-FAST PIB2403251909945318 CHIN CHEN POOI OTHR TRANSFER - MOBILE,PAYNOW-FAST PIB2403251909945318 CHIN CHEN POOI OTHR TRANSFER - MOBILE,R15_GENERIC_OUTFLOW,1,-1200.0,-1200.0,2024-03,2024-03,1,1,ONE_OFF,FAST:$1200,POSSIBLE_TRANSFER
OTHER_INCOME,INWARD CR - GIRO OTHR OTHER GOV GOV,INWARD CR - GIRO OTHR OTHER GOV GOV,R14_OTHER_INCOME,4,1100.0,275.0,2023-12,2024-12,13,2,ONE_OFF,GIRO:$1100,
DISCRETIONARY,PAYNOW-FAST PIB2407263080067875 GLOBAL TOTS MOUNTBAT OTHR SIOW WENLONG INFANT MA,PAYNOW-FAST PIB2407263080067875 GLOBAL TOTS MOUNTBAT OTHR SIOW WENLONG INFANT MA,R15_GENERIC_OUTFLOW,1,-1090.0,-1090.0,2024-07,2024-07,1,1,ONE_OFF,FAST:$1090,POSSIBLE_TRANSFER
DISCRETIONARY,PAYNOW-FAST SOON SENG TRANSPORT MBK2401291375346896,PAYNOW-FAST SOON SENG TRANSPORT MBK2401291375346896,R15_GENERIC_OUTFLOW,1,-1050.0,-1050.0,2024-01,2024-01,1,1,ONE_OFF,FAST:$1050,POSSIBLE_TRANSFER
OTHER_INCOME,INWARD CR - GIRO SUPP SUPPLIERPYMT MSF-CH DEVELOPMENT MSF-BBBB2025332452,INWARD CR - GIRO SUPP SUPPLIERPYMT MSF-CH DEVELOPMENT MSF-BBBB2025332452,R14_OTHER_INCOME,1,1000.0,1000.0,2025-10,2025-10,1,1,ONE_OFF,GIRO:$1000,
OTHER_INCOME,PAYNOW-FAST PAYNOW OTHR CHAI CHANG HONG OTP,PAYNOW-FAST PAYNOW OTHR CHAI CHANG HONG OTP,R14_OTHER_INCOME,1,1000.0,1000.0,2023-08,2023-08,1,1,ONE_OFF,FAST:$1000,
DISCRETIONARY,PAYNOW-FAST PIB2410243967754638 WEE SWEE TEOW LLP OTHR 20241282,PAYNOW-FAST PIB2410243967754638 WEE SWEE TEOW LLP OTHR 20241282,R15_GENERIC_OUTFLOW,1,-1000.0,-1000.0,2024-10,2024-10,1,1,ONE_OFF,FAST:$1000,POSSIBLE_TRANSFER
DISCRETIONARY,PAYNOW-FAST PIB2409203630703622 GLOBAL TOTS MOUNTBAT OTHR SIOW WENLONG INFANT MA,PAYNOW-FAST PIB2409203630703622 GLOBAL TOTS MOUNTBAT OTHR SIOW WENLONG INFANT MA,R15_GENERIC_OUTFLOW,1,-980.0,-980.0,2024-09,2024-09,1,1,ONE_OFF,FAST:$980,POSSIBLE_TRANSFER
DISCRETIONARY,PAYNOW-FAST PIB2311280801479624 THREECUBES PRIVATE L OTHR TRANSFER - UEN,PAYNOW-FAST PIB2311280801479624 THREECUBES PRIVATE L OTHR TRANSFER - UEN,R15_GENERIC_OUTFLOW,1,-920.0,-920.0,2023-11,2023-11,1,1,ONE_OFF,FAST:$920,POSSIBLE_TRANSFER
DISCRETIONARY,FUNDS TRF - FAST PIB2411284327098825 4179710531543065 CCRD TRANSFER,FUNDS TRF - FAST PIB2411284327098825 4179710531543065 CCRD TRANSFER,R15_GENERIC_OUTFLOW,1,-893.99,-893.99,2024-11,2024-11,1,1,ONE_OFF,FAST:$893,POSSIBLE_TRANSFER
DISCRETIONARY,PAYNOW-FAST PIB2402181566824221 JAYKEN FOO OTHR TRANSFER - MOBILE,PAYNOW-FAST PIB2402181566824221 JAYKEN FOO OTHR TRANSFER - MOBILE,R15_GENERIC_OUTFLOW,1,-891.8,-891.8,2024-02,2024-02,1,1,ONE_OFF,FAST:$891,POSSIBLE_TRANSFER
DISCRETIONARY,PAYNOW-FAST PIB2401071177403840 POSTER HUB OTHR 201411282EDBS0ES013357551,PAYNOW-FAST PIB2401071177403840 POSTER HUB OTHR 201411282EDBS0ES013357551,R15_GENERIC_OUTFLOW,1,-876.4,-876.4,2024-01,2024-01,1,1,ONE_OFF,FAST:$876,POSSIBLE_TRANSFER
DISCRETIONARY,PAYNOW-FAST KAI JOO HUNG OPTICA MBK2509207564184780,PAYNOW-FAST KAI JOO HUNG OPTICA MBK2509207564184780,R15_GENERIC_OUTFLOW,1,-866.0,-866.0,2025-09,2025-09,1,1,ONE_OFF,FAST:$866,POSSIBLE_TRANSFER
DISCRETIONARY,PAYNOW-FAST HENDRICK EDMUND ANA MBK2410153888384278,PAYNOW-FAST HENDRICK EDMUND ANA MBK2410153888384278,R15_GENERIC_OUTFLOW,1,-850.0,-850.0,2024-10,2024-10,1,1,ONE_OFF,FAST:$850,POSSIBLE_TRANSFER
OTHER_INCOME,INWARD CREDIT-FAST PAYNOW OTHR SIOW WEI JIE GPAY-,INWARD CREDIT-FAST PAYNOW OTHR SIOW WEI JIE GPAY-,R14_OTHER_INCOME,1,832.7,832.7,2022-05,2022-05,1,1,ONE_OFF,FAST:$832,
DISCRETIONARY,PAYNOW-FAST WINDOW VIEW INTERIO MBK2209057508814345,PAYNOW-FAST WINDOW VIEW INTERIO MBK2209057508814345,R15_GENERIC_OUTFLOW,1,-800.0,-800.0,2022-09,2022-09,1,1,ONE_OFF,FAST:$800,POSSIBLE_TRANSFER
DISCRETIONARY,PAYNOW-FAST PIB2312190999645610 WOOD & WOOD FLOORING OTHR WW/QT/ET-23-113 (VO),PAYNOW-FAST PIB2312190999645610 WOOD & WOOD FLOORING OTHR WW/QT/ET-23-113 (VO),R15_GENERIC_OUTFLOW,1,-756.0,-756.0,2023-12,2023-12,1,1,ONE_OFF,FAST:$756,POSSIBLE_TRANSFER
OTHER_INCOME,INWARD CR - GIRO OTHR OTHER GOVT PAYOUT GOVT PAYOUT,INWARD CR - GIRO OTHR OTHER GOVT PAYOUT GOVT PAYOUT,R14_OTHER_INCOME,4,750.0,187.5,2022-12,2023-06,7,2,ONE_OFF,GIRO:$750,
DISCRETIONARY,PAYNOW-FAST PIB2402021426621806 CHIN CHEN POOI OTHR 7 AMBER GARDENS,PAYNOW-FAST PIB2402021426621806 CHIN CHEN POOI OTHR 7 AMBER GARDENS,R15_GENERIC_OUTFLOW,1,-750.0,-750.0,2024-02,2024-02,1,1,ONE_OFF,FAST:$750,POSSIBLE_TRANSFER
DISCRETIONARY,PAYNOW-FAST PIB2502215202811792 TOTAL CLEANZ PTE. LT OTHR TRANSFER - UEN,PAYNOW-FAST PIB2502215202811792 TOTAL CLEANZ PTE. LT OTHR TRANSFER - UEN,R15_GENERIC_OUTFLOW,1,-732.48,-732.48,2025-02,2025-02,1,1,ONE_OFF,FAST:$732,POSSIBLE_TRANSFER
DISCRETIONARY,PAYNOW-FAST PIB2312040865851523 LIGHTS AND BATHROOM OTHR SO-23-32269T,PAYNOW-FAST PIB2312040865851523 LIGHTS AND BATHROOM OTHR SO-23-32269T,R15_GENERIC_OUTFLOW,1,-656.0,-656.0,2023-12,2023-12,1,1,ONE_OFF,FAST:$656,POSSIBLE_TRANSFER
DISCRETIONARY,PAYNOW-FAST PIB2311240766474947 MYLIFESTYLE HOLDINGS OTHR 90405858,PAYNOW-FAST PIB2311240766474947 MYLIFESTYLE HOLDINGS OTHR 90405858,R15_GENERIC_OUTFLOW,1,-500.0,-500.0,2023-11,2023-11,1,1,ONE_OFF,FAST:$500,POSSIBLE_TRANSFER
DISCRETIONARY,PAYNOW-FAST PIB2403161825438191 SOLAR AIR-CON & ELEC OTHR 20240316-135956264,PAYNOW-FAST PIB2403161825438191 SOLAR AIR-CON & ELEC OTHR 20240316-135956264,R15_GENERIC_OUTFLOW,1,-480.0,-480.0,2024-03,2024-03,1,1,ONE_OFF,FAST:$480,POSSIBLE_TRANSFER
DISCRETIONARY,PAYNOW-FAST PIB2506296601561512 TOTAL CLEANZ PTE. LT OTHR SO-202502-00137,PAYNOW-FAST PIB2506296601561512 TOTAL CLEANZ PTE. LT OTHR SO-202502-00137,R15_GENERIC_OUTFLOW,1,-457.8,-457.8,2025-06,2025-06,1,1,ONE_OFF,FAST:$457,POSSIBLE_TRANSFER
DISCRETIONARY,PAYNOW-FAST PIB2508277284924544 TOTAL CLEANZ PTE. LT OTHR SI- 2322019,PAYNOW-FAST PIB2508277284924544 TOTAL CLEANZ PTE. LT OTHR SI- 2322019,R15_GENERIC_OUTFLOW,1,-457.8,-457.8,2025-08,2025-08,1,1,ONE_OFF,FAST:$457,POSSIBLE_TRANSFER
DISCRETIONARY,CASH WITHDRAWAL-ATM 79608190,CASH WITHDRAWAL-ATM 79608190,R15_GENERIC_OUTFLOW,4,-440.0,-110.0,2021-02,2021-07,6,3,SPORADIC,ATM:$440,
DISCRETIONARY,PAYNOW-FAST YEE SIN STORAGE MBK2404232180559368,PAYNOW-FAST YEE SIN STORAGE MBK2404232180559368,R15_GENERIC_OUTFLOW,1,-440.0,-440.0,2024-04,2024-04,1,1,ONE_OFF,FAST:$440,POSSIBLE_TRANSFER
DISCRETIONARY,PAYNOW-FAST J WONG MBK2509017337519418,PAYNOW-FAST J WONG MBK2509017337519418,R15_GENERIC_OUTFLOW,1,-382.0,-382.0,2025-09,2025-09,1,1,ONE_OFF,FAST:$382,POSSIBLE_TRANSFER
DISCRETIONARY,PAYNOW-FAST PIB2403181840103282 TANG NAM CHAI OTHR TRANSFER - MOBILE,PAYNOW-FAST PIB2403181840103282 TANG NAM CHAI OTHR TRANSFER - MOBILE,R15_GENERIC_OUTFLOW,1,-380.0,-380.0,2024-03,2024-03,1,1,ONE_OFF,FAST:$380,POSSIBLE_TRANSFER
OTHER_INCOME,INWARD CR - GIRO OTHR OTHER INTEGRATED HEALTH PL SGGP220126102668,INWARD CR - GIRO OTHR OTHER INTEGRATED HEALTH PL SGGP220126102668,R14_OTHER_INCOME,1,377.92,377.92,2022-01,2022-01,1,1,ONE_OFF,GIRO:$377,
DISCRETIONARY,PAYNOW-FAST PIB2505276240921997 TOTAL CLEANZ PTE. LT OTHR SO-202502-00137,PAYNOW-FAST PIB2505276240921997 TOTAL CLEANZ PTE. LT OTHR SO-202502-00137,R15_GENERIC_OUTFLOW,1,-366.24,-366.24,2025-05,2025-05,1,1,ONE_OFF,FAST:$366,POSSIBLE_TRANSFER
DISCRETIONARY,PAYNOW-FAST PIB2507276923728892 TOTAL CLEANZ PTE. LT OTHR SI- 2321550,PAYNOW-FAST PIB2507276923728892 TOTAL CLEANZ PTE. LT OTHR SI- 2321550,R15_GENERIC_OUTFLOW,1,-366.24,-366.24,2025-07,2025-07,1,1,ONE_OFF,FAST:$366,POSSIBLE_TRANSFER
DISCRETIONARY,PAYNOW-FAST PIB2509277644321354 TOTAL CLEANZ PTE. LT OTHR SI-2322487,PAYNOW-FAST PIB2509277644321354 TOTAL CLEANZ PTE. LT OTHR SI-2322487,R15_GENERIC_OUTFLOW,1,-366.24,-366.24,2025-09,2025-09,1,1,ONE_OFF,FAST:$366,POSSIBLE_TRANSFER
DISCRETIONARY,PAYNOW-FAST PIB2510277986308950 TOTAL CLEANZ PTE. LT OTHR SO-202502-00137,PAYNOW-FAST PIB2510277986308950 TOTAL CLEANZ PTE. LT OTHR SO-202502-00137,R15_GENERIC_OUTFLOW,1,-366.24,-366.24,2025-10,2025-10,1,1,ONE_OFF,FAST:$366,POSSIBLE_TRANSFER
DISCRETIONARY,PAYNOW-FAST PIB2411014056778079 WEE SWEE TEOW LLP OTHR 20241464,PAYNOW-FAST PIB2411014056778079 WEE SWEE TEOW LLP OTHR 20241464,R15_GENERIC_OUTFLOW,1,-354.75,-354.75,2024-11,2024-11,1,1,ONE_OFF,FAST:$354,POSSIBLE_TRANSFER
DISCRETIONARY,PAYNOW-FAST SOON SENG TRANSPORT MBK2403011683246541,PAYNOW-FAST SOON SENG TRANSPORT MBK2403011683246541,R15_GENERIC_OUTFLOW,1,-350.0,-350.0,2024-03,2024-03,1,1,ONE_OFF,FAST:$350,POSSIBLE_TRANSFER
DISCRETIONARY,PAYNOW-FAST PIB2501164838381235 HATCHERY CRIBS PTE L OTHR QS,PAYNOW-FAST PIB2501164838381235 HATCHERY CRIBS PTE L OTHR QS,R15_GENERIC_OUTFLOW,1,-319.0,-319.0,2025-01,2025-01,1,1,ONE_OFF,FAST:$319,POSSIBLE_TRANSFER
DISCRETIONARY,PAYNOW-FAST PIB2208277454311803 TONY KU OTHR TRANSFER - MOBILE,PAYNOW-FAST PIB2208277454311803 TONY KU OTHR TRANSFER - MOBILE,R15_GENERIC_OUTFLOW,1,-300.0,-300.0,2022-08,2022-08,1,1,ONE_OFF,FAST:$300,POSSIBLE_TRANSFER
DISCRETIONARY,PAYNOW-FAST PIB2311300822614576 WEE SWEE TEOW LLP OTHR LCY/2023/1697/MT,PAYNOW-FAST PIB2311300822614576 WEE SWEE TEOW LLP OTHR LCY/2023/1697/MT,R15_GENERIC_OUTFLOW,1,-300.0,-300.0,2023-11,2023-11,1,1,ONE_OFF,FAST:$300,POSSIBLE_TRANSFER
DISCRETIONARY,PAYNOW-FAST PIB2404042007990522 9DOORS(S) PTE. LTD. OTHR P50520ET,PAYNOW-FAST PIB2404042007990522 9DOORS(S) PTE. LTD. OTHR P50520ET,R15_GENERIC_OUTFLOW,1,-299.0,-299.0,2024-04,2024-04,1,1,ONE_OFF,FAST:$299,POSSIBLE_TRANSFER
DISCRETIONARY,PAYNOW-FAST PIB2112056019597030 SIOW WEI JIE OTHR TRANSFER - MOBILE,PAYNOW-FAST PIB2112056019597030 SIOW WEI JIE OTHR TRANSFER - MOBILE,R15_GENERIC_OUTFLOW,1,-288.0,-288.0,2021-12,2021-12,1,1,ONE_OFF,FAST:$288,POSSIBLE_TRANSFER
DISCRETIONARY,FUNDS TRF - FAST PIB2409043481073408 0010468600 OTHR 2408027977526,FUNDS TRF - FAST PIB2409043481073408 0010468600 OTHR 2408027977526,R15_GENERIC_OUTFLOW,1,-285.0,-285.0,2024-09,2024-09,1,1,ONE_OFF,FAST:$285,POSSIBLE_TRANSFER
DISCRETIONARY,PAYNOW-FAST PIB2401021123085037 SOONSENGTPTMOVERS OTHR 21728,PAYNOW-FAST PIB2401021123085037 SOONSENGTPTMOVERS OTHR 21728,R15_GENERIC_OUTFLOW,1,-280.0,-280.0,2024-01,2024-01,1,1,ONE_OFF,FAST:$280,POSSIBLE_TRANSFER
DISCRETIONARY,PAYNOW-FAST PIB2312040865381454 JAYKEN FOO OTHR TRANSFER - MOBILE,PAYNOW-FAST PIB2312040865381454 JAYKEN FOO OTHR TRANSFER - MOBILE,R15_GENERIC_OUTFLOW,1,-253.8,-253.8,2023-12,2023-12,1,1,ONE_OFF,FAST:$253,POSSIBLE_TRANSFER
DISCRETIONARY,PAYNOW-FAST PIB2410083815701491 KELVIN TAY OTHR TRANSFER - MOBILE,PAYNOW-FAST PIB2410083815701491 KELVIN TAY OTHR TRANSFER - MOBILE,R15_GENERIC_OUTFLOW,1,-250.0,-250.0,2024-10,2024-10,1,1,ONE_OFF,FAST:$250,POSSIBLE_TRANSFER
DISCRETIONARY,PAYNOW-FAST J WONG MBK2505025961004541,PAYNOW-FAST J WONG MBK2505025961004541,R15_GENERIC_OUTFLOW,1,-242.79,-242.79,2025-05,2025-05,1,1,ONE_OFF,FAST:$242,POSSIBLE_TRANSFER
DISCRETIONARY,PAYNOW-FAST J WONG MBK2507026643658353,PAYNOW-FAST J WONG MBK2507026643658353,R15_GENERIC_OUTFLOW,1,-242.79,-242.79,2025-07,2025-07,1,1,ONE_OFF,FAST:$242,POSSIBLE_TRANSFER
DISCRETIONARY,PAYNOW-FAST SOON SENG TRANSPORT MBK2403211869639312,PAYNOW-FAST SOON SENG TRANSPORT MBK2403211869639312,R15_GENERIC_OUTFLOW,1,-200.0,-200.0,2024-03,2024-03,1,1,ONE_OFF,FAST:$200,POSSIBLE_TRANSFER
DISCRETIONARY,PAYNOW-FAST PIB2211067870187728 SIOW WEI JIE OTHR TRANSFER - MOBILE,PAYNOW-FAST PIB2211067870187728 SIOW WEI JIE OTHR TRANSFER - MOBILE,R15_GENERIC_OUTFLOW,1,-188.0,-188.0,2022-11,2022-11,1,1,ONE_OFF,FAST:$188,POSSIBLE_TRANSFER
DISCRETIONARY,MISC DEBIT DHOF123153822301 UOI FIRE POLICY,MISC DEBIT DHOF123153822301 UOI FIRE POLICY,R15_GENERIC_OUTFLOW,1,-187.63,-187.63,2024-11,2024-11,1,1,ONE_OFF,OTHER:$187,
DISCRETIONARY,MISC DEBIT DHOF123153822302 UOI FIRE POLICY,MISC DEBIT DHOF123153822302 UOI FIRE POLICY,R15_GENERIC_OUTFLOW,1,-187.63,-187.63,2025-11,2025-11,1,1,ONE_OFF,OTHER:$187,
DISCRETIONARY,MISC DEBIT DHOF123153822300 UOI FIRE POLICY,MISC DEBIT DHOF123153822300 UOI FIRE POLICY,R15_GENERIC_OUTFLOW,1,-185.91,-185.91,2023-12,2023-12,1,1,ONE_OFF,OTHER:$185,
DISCRETIONARY,PAYNOW-FAST CKK MANAGEMENT PTE MBK2404122084604809,PAYNOW-FAST CKK MANAGEMENT PTE MBK2404122084604809,R15_GENERIC_OUTFLOW,1,-185.3,-185.3,2024-04,2024-04,1,1,ONE_OFF,FAST:$185,POSSIBLE_TRANSFER
DISCRETIONARY,PAYNOW-FAST PIB2308149910214485 A LIGHTZ SHOP LLP OTHR TRANSFER - UEN,PAYNOW-FAST PIB2308149910214485 A LIGHTZ SHOP LLP OTHR TRANSFER - UEN,R15_GENERIC_OUTFLOW,1,-177.0,-177.0,2023-08,2023-08,1,1,ONE_OFF,FAST:$177,POSSIBLE_TRANSFER
DISCRETIONARY,PAYNOW-FAST MIELE PTE LTD MBK2403211869375206,PAYNOW-FAST MIELE PTE LTD MBK2403211869375206,R15_GENERIC_OUTFLOW,1,-167.0,-167.0,2024-03,2024-03,1,1,ONE_OFF,FAST:$167,POSSIBLE_TRANSFER
DISCRETIONARY,PAYNOW-FAST CKK MANAGEMENT PTE MBK2403221879894623,PAYNOW-FAST CKK MANAGEMENT PTE MBK2403221879894623,R15_GENERIC_OUTFLOW,1,-163.5,-163.5,2024-03,2024-03,1,1,ONE_OFF,FAST:$163,POSSIBLE_TRANSFER
